{
  "batch_protocol_version": "1",
  "batch_id": "b1000000-0000-4000-8000-000000000001",
  "limits": {"max_batch_size": 16, "max_parallel_scans": 1, "max_parallel_external_processes": 1, "max_temp_bytes": 67108864, "max_output_bytes": 16777216},
  "scans": [
    {"schema_version":"1", "scan_id":"c1000000-0000-4000-8000-000000000011", "target":"https://alpha.example.com", "profile":"quick", "mode":"public"},
    {"schema_version":"1", "scan_id":"c1000000-0000-4000-8000-000000000012", "target":"https://beta.example.com", "profile":"quick", "mode":"public"},
    {"schema_version":"1", "scan_id":"c1000000-0000-4000-8000-000000000013", "target":"https://gamma.example.com", "profile":"quick", "mode":"public"}
  ]
}
